{
  "$schema": "./theme-config.schema.json",
  "name": "Unisane Blue",
  "description": "Default blue theme - professional and trustworthy",

  "primary": {
    "hue": 230,
    "chroma": 0.15,
    "comment": "Core blue (230°) tuned to avoid cyan drift on white-first surfaces"
  },

  "secondary": {
    "strategy": "analogous",
    "hueShift": 0,
    "chromaScale": 0.7,
    "comment": "Moderately muted secondary for cleaner UI hierarchy"
  },

  "tertiary": {
    "strategy": "complementary",
    "hueShift": 60,
    "chromaScale": 0.7,
    "comment": "Purple/magenta accent (60° shift from blue)"
  },

  "neutral": {
    "strategy": "tinted",
    "tintFromPrimary": 0.012,
    "comment": "Subtle neutral tint to keep whites clean while preserving brand character"
  },

  "error": {
    "hue": 25,
    "chroma": 0.18,
    "comment": "Red for errors - fixed across themes"
  }
}
